title,first_submission_date,source_tag,source_detail,entry_type,trust_note
Vision-Language Navigation: A Survey and Taxonomy,2021-08-26,survey-citation,arXiv survey seed,survey,trusted
"Vision-and-Language Navigation: A Survey of Tasks, Methods, and Future Directions",2022-03-22,survey-citation,ACL/arXiv survey seed,survey,trusted
Visual language navigation: a survey and open challenges,2022-03-25,survey-citation,journal survey seed,survey,trusted; published-online date used temporarily because no arXiv preprint is confirmed yet
Vision-Language Navigation with Embodied Intelligence: A Survey,2024-02-22,survey-citation,arXiv survey candidate,survey,withdrawn; not trusted for seeding
Vision-and-Language Navigation Today and Tomorrow: A Survey in the Era of Foundation Models,2024-07-09,survey-citation,arXiv survey seed,survey,trusted
A Survey of Embodied AI: From Simulators to Research Tasks,2021-03-08,survey-citation,broader embodied survey,survey,trusted secondary
Foundation Models for Embodied Navigation: A Survey,2026-03-25,survey-citation,project-page/PDF survey,survey,trusted secondary
A comprehensive review of recent advancements in vision-and-language navigation,2026-03-21,survey-citation,journal review,survey,trusted secondary; journal date used temporarily because no arXiv preprint is confirmed yet
Vision-and-Language Navigation: Interpreting visually-grounded navigation instructions in real environments,2017-11-20,survey-citation,seeded from trusted surveys and cross-checked with awesome-vln,core-paper,trusted
Speaker-Follower Models for Vision-and-Language Navigation,2018-06-07,survey-citation,seeded from trusted surveys and cross-checked with awesome-vln,core-paper,trusted
Self-Monitoring Navigation Agent via Auxiliary Progress Estimation,2019-01-10,survey-citation,seeded from trusted surveys and cross-checked with awesome-vln,core-paper,trusted
Tactical Rewind: Self-Correction via Backtracking in Vision-and-Language Navigation,2019-03-06,survey-citation,seeded from trusted surveys and cross-checked with awesome-vln,core-paper,trusted
Learning to Navigate Unseen Environments: Back Translation with Environmental Dropout,2019-04-08,survey-citation,seeded from trusted surveys and cross-checked with awesome-vln,core-paper,trusted
REVERIE: Remote Embodied Visual Referring Expression in Real Indoor Environments,2019-04-23,survey-citation,seeded from trusted surveys and cross-checked with awesome-vln,core-paper,trusted
Vision-and-Dialog Navigation,2019-07-10,survey-citation,seeded from trusted surveys and cross-checked with awesome-vln,core-paper,trusted
Just Ask: An Interactive Learning Framework for Vision and Language Navigation,2019-12-02,survey-citation,seeded from trusted surveys and cross-checked with awesome-vln,core-paper,trusted
Beyond the Nav-Graph: Vision-and-Language Navigation in Continuous Environments,2020-04-06,survey-citation,seeded from trusted surveys and cross-checked with awesome-vln,core-paper,trusted
BabyWalk: Going Farther in Vision-and-Language Navigation by Taking Baby Steps,2020-05-10,survey-citation,seeded from trusted surveys and cross-checked with awesome-vln,core-paper,trusted
A Recurrent Vision-and-Language BERT for Navigation,2020-11-26,survey-citation,seeded from trusted surveys and cross-checked with awesome-vln,core-paper,trusted
Topological Planning with Transformers for Vision-and-Language Navigation,2020-12-09,survey-citation,seeded from trusted surveys and cross-checked with awesome-vln,core-paper,trusted
Towards Learning a Generic Agent for Vision-and-Language Navigation via Pre-training,2020-02-25,survey-citation,seeded from trusted surveys and cross-checked with awesome-vln,core-paper,trusted
Improving Vision-and-Language Navigation with Image-Text Pairs from the Web,2020-04-30,survey-citation,seeded from trusted surveys and cross-checked with awesome-vln,core-paper,trusted
Active Visual Information Gathering for Vision-Language Navigation,2020-07-15,survey-citation,seeded from trusted surveys and cross-checked with awesome-vln,core-paper,trusted
Robust Navigation with Language Pretraining and Stochastic Sampling,2019-09-05,survey-citation,seeded from trusted surveys and cross-checked with awesome-vln,core-paper,trusted
Are You Looking? Grounding to Multiple Modalities in Vision-and-Language Navigation,2019-06-02,survey-citation,seeded from trusted surveys and cross-checked with awesome-vln,analysis-paper,trusted
Episodic Transformer for Vision-and-Language Navigation,2021-05-13,survey-citation,seeded from trusted surveys and cross-checked with awesome-vln,core-paper,trusted
The Road to Know-Where: An Object-and-Room Informed Sequential BERT for Indoor Vision-Language Navigation,2021-04-09,survey-citation,seeded from trusted surveys and cross-checked with awesome-vln,core-paper,trusted
Airbert: In-domain Pretraining for Vision-and-Language Navigation,2021-08-20,survey-citation,seeded from trusted surveys and cross-checked with awesome-vln,core-paper,trusted
SOAT: A Scene- and Object-Aware Transformer for Vision-and-Language Navigation,2021-10-27,survey-citation,seeded from trusted surveys and cross-checked with awesome-vln,core-paper,trusted
Landmark-RxR: Solving Vision-and-Language Navigation with Fine-Grained Alignment Supervision,2021-11-09,survey-citation,seeded from trusted surveys and cross-checked with awesome-vln,core-paper,currently using conference/openreview date; arXiv preprint not yet confirmed
EnvEdit: Environment Editing for Vision-and-Language Navigation,2022-03-29,survey-citation,seeded from trusted surveys and cross-checked with awesome-vln,core-paper,trusted
NavGPT: Explicit Reasoning in Vision-and-Language Navigation with Large Language Models,2023-05-26,survey-citation,seeded from trusted surveys plus recent VLN survey,llm-era-paper,trusted
PanoGen: Text-Conditioned Panoramic Environment Generation for Vision-and-Language Navigation,2023-05-30,survey-citation,seeded from trusted surveys plus recent VLN survey,llm-era-paper,trusted
AerialVLN: Vision-and-Language Navigation for UAVs,2023-08-13,survey-citation,seeded from recent survey and maintained GitHub resources,aerial-vln-paper,trusted
"Towards Long-Horizon Vision-Language Navigation: Platform, Benchmark and Method",2024-12-12,survey-citation,seeded from maintained GitHub resources and recent VLN search,long-horizon-paper,trusted
AIGeN: An Adversarial Approach for Instruction Generation in VLN,2024-04-15,awesome-repo,seeded from awesome-vln data-augmentation list and arXiv-first date verification,data-centric-paper,trusted
Dialogue-enabled agents for embodied instruction following,2022-02-27,awesome-repo,seeded from awesome-vln dialog list and arXiv-first date verification,dialog-paper,trusted secondary
One Step at a Time: Long-Horizon Vision-and-Language Navigation with Milestones,2022-02-14,awesome-repo,seeded from awesome-vln planning list and arXiv-first date verification,long-horizon-paper,trusted
Curriculum Learning for Vision-and-Language Navigation,2021-11-14,awesome-repo,seeded from awesome-vln curriculum list and arXiv-first date verification,curriculum-paper,trusted
Waypoint Models for Instruction-guided Navigation in Continuous Environments,2021-10-05,awesome-repo,seeded from awesome-vln planning list and arXiv-first date verification,continuous-env-planning-paper,trusted
Task-driven Embodied Agents that Chat,2021-10-01,awesome-repo,seeded from awesome-vln dialog list and arXiv-first date verification,dialog-embodied-agent-paper,trusted secondary
SASRA: Semantically-aware Spatio-temporal Reasoning Agent for Vision-and-Language Navigation in Continuous Environments,2021-08-26,awesome-repo,seeded from awesome-vln semantic-understanding list and arXiv-first date verification,continuous-env-paper,trusted
Neighbor-view Enhanced Model for Vision and Language Navigation,2021-07-15,awesome-repo,seeded from awesome-vln planning list and arXiv-first date verification,planning-paper,trusted
Vision-Language Navigation with Random Environmental Mixup,2021-06-15,awesome-repo,seeded from awesome-vln data-augmentation list and arXiv-first date verification,data-centric-paper,trusted
Pathdreamer: A World Model for Indoor Navigation,2021-05-18,awesome-repo,seeded from awesome-vln exploration list and arXiv-first date verification,world-model-paper,trusted secondary
Diagnosing Vision-and-Language Navigation: What Really Matters,2021-03-30,awesome-repo,seeded from awesome-vln semantic-understanding list and arXiv-first date verification,analysis-paper,trusted
The RobotSlang Benchmark: Dialog-guided Robot Localization and Navigation,2020-10-23,awesome-repo,seeded from awesome-vln dialog list and arXiv-first date verification,dialog-benchmark-paper,trusted
Language and Visual Entity Relationship Graph for Agent Navigation,2020-10-19,awesome-repo,seeded from awesome-vln graph-representation list and arXiv-first date verification,graph-paper,trusted
Multilingual Vision-and-Language Navigation with Dense Spatiotemporal Grounding,2020-10-15,awesome-repo,seeded from awesome-vln datasets list and arXiv-first date verification,multilingual-paper,trusted
Learning to Stop: A Simple yet Effective Approach to Urban Vision-Language Navigation,2020-09-28,awesome-repo,seeded from awesome-vln planning list and arXiv-first date verification,urban-planning-paper,trusted
Object-and-Action Aware Model for Visual Language Navigation,2020-07-29,awesome-repo,seeded from awesome-vln semantic-understanding list and arXiv-first date verification,representation-paper,trusted
Evolving Graphical Planner: Contextual Global Planning for Vision-and-Language Navigation,2020-07-11,awesome-repo,seeded from awesome-vln graph-representation list and arXiv-first date verification,planning-paper,trusted
Environment-agnostic Multitask Learning for Natural Language Grounded Navigation,2020-03-01,awesome-repo,seeded from awesome-vln multitask list and arXiv-first date verification,multitask-paper,trusted
RMM: A Recursive Mental Model for Dialog Navigation,2020-05-02,awesome-repo,seeded from awesome-vln asking-for-help list and arXiv-first date verification,dialog-reasoning-paper,trusted
Cross-Lingual Vision-Language Navigation,2019-10-24,awesome-repo,seeded from awesome-vln datasets list and arXiv-first date verification,multilingual-paper,trusted
Counterfactual Vision-and-Language Navigation via Adversarial Path Sampling,2019-11-17,awesome-repo,seeded from awesome-vln data-augmentation list and arXiv-first date verification,data-centric-paper,trusted
General Evaluation for Instruction Conditioned Navigation using Dynamic Time Warping,2019-07-11,awesome-repo,seeded from awesome-vln evaluation list and arXiv-first date verification,evaluation-paper,trusted
Navigating New York City through Grounded Dialogue,2018-07-09,awesome-repo,seeded from awesome-vln dialog list and arXiv-first date verification,dialog-navigation-paper,trusted secondary
Embodied Vision-and-Language Navigation with Dynamic Convolutional Filters,2019-07-05,awesome-repo,seeded from awesome-vln semantic-understanding list and arXiv-first date verification,representation-paper,trusted
Chasing Ghosts: Instruction Following as Bayesian State Tracking,2019-07-03,awesome-repo,seeded from awesome-vln graph-representation list and arXiv-first date verification,graph-state-paper,trusted
The Streetlearn Environment and Dataset,2019-03-04,awesome-repo,seeded from awesome-vln datasets list and arXiv-first date verification,dataset-paper,trusted secondary
Learning To Follow Directions in Street View,2019-03-01,awesome-repo,seeded from awesome-vln datasets list and arXiv-first date verification,urban-navigation-paper,trusted secondary
Vision-based Navigation with Language-based Assistance via Imitation Learning with Indirect Intervention,2018-12-10,awesome-repo,seeded from awesome-vln guidance list and arXiv-first date verification,guidance-paper,trusted
Mapping Instructions to Actions in 3D Environments with Visual Goal Prediction,2018-09-04,awesome-repo,seeded from awesome-vln datasets list and arXiv-first date verification,dataset-task-paper,trusted
On Evaluation of Embodied Navigation Agents,2018-07-18,awesome-repo,seeded from awesome-vln evaluation list and arXiv-first date verification,evaluation-paper,trusted
Following High-level Navigation Instructions on a Simulated Quadcopter with Imitation Learning,2018-05-31,awesome-repo,seeded from awesome-vln datasets list and arXiv-first date verification,aerial-precursor-paper,trusted
Iqa: Visual Question Answering in Interactive Environments,2017-12-09,awesome-repo,seeded from awesome-vln datasets list and arXiv-first date verification,embodied-qa-boundary-paper,trusted secondary
LiveVLN: Breaking the Stop-and-Go Loop in Vision-Language Navigation,2026-04-21,arxiv-search,seeded from targeted arXiv search for recent continuous VLN work,continuous-vln-paper,trusted
"VLNVerse: A Benchmark for Vision-Language Navigation with Versatile, Embodied, Realistic Simulation and Evaluation",2025-12-22,arxiv-search,seeded from targeted arXiv search for recent benchmark-era VLN work,benchmark-paper,trusted
JanusVLN: Decoupling Semantics and Spatiality with Dual Implicit Memory for Vision-Language Navigation,2025-09-26,arxiv-search,seeded from targeted arXiv search for recent memory-centric VLN work,memory-paper,trusted
VLN-Zero: Rapid Exploration and Cache-Enabled Neurosymbolic Vision-Language Planning for Zero-Shot Transfer in Robot Navigation,2025-09-23,arxiv-search,seeded from targeted arXiv search and validated with the project page,foundation-model-paper,trusted
StreamVLN: Streaming Vision-and-Language Navigation via SlowFast Context Modeling,2025-07-07,arxiv-search,seeded from targeted arXiv search for streaming and continuous VLN,continuous-vln-paper,trusted
MapNav: A Novel Memory Representation via Annotated Semantic Maps for Vision-and-Language Navigation,2025-02-19,arxiv-search,seeded from targeted arXiv search for map- and memory-based VLN,map-memory-paper,trusted
"Towards Realistic UAV Vision-Language Navigation: Platform, Benchmark, and Methodology",2024-10-09,arxiv-search,seeded from targeted arXiv search for UAV VLN,uav-benchmark-paper,trusted
Affordances-Oriented Planning using Foundation Models for Continuous Vision-Language Navigation,2024-07-08,arxiv-search,seeded from targeted arXiv search for continuous VLN with foundation models,foundation-model-paper,trusted
Target-Grounded Graph-Aware Transformer for Aerial Vision-and-Dialog Navigation,2023-08-22,arxiv-search,seeded from targeted arXiv search around aerial dialog navigation,aerial-dialog-paper,trusted
Aerial Vision-and-Dialog Navigation,2022-05-24,awesome-repo,seeded from awesome-vln dialog section and arXiv-first date verification,aerial-dialog-paper,trusted
History Aware Multimodal Transformer for Vision-and-Language Navigation,2021-10-25,awesome-repo,seeded from awesome-vln memory-augmented list and arXiv-first date verification,memory-paper,trusted
Language-Aligned Waypoint (LAW) Supervision for Vision-and-Language Navigation in Continuous Environments,2021-09-30,arxiv-search,seeded from targeted arXiv search for continuous VLN supervision,continuous-vln-paper,trusted
Rethinking the Spatial Route Prior in Vision-and-Language Navigation,2021-10-12,arxiv-search,seeded from targeted arXiv search for route-prior VLN work,route-prior-paper,trusted
Hierarchical Cross-Modal Agent for Robotics Vision-and-Language Navigation,2021-04-21,arxiv-search,seeded from awesome-vln benchmark section and arXiv-first date verification,robotics-vln-paper,trusted
Scene-Intuitive Agent for Remote Embodied Visual Grounding,2021-03-24,arxiv-search,seeded from awesome-vln remote-grounding list and arXiv-first date verification,remote-grounding-paper,trusted
On the Evaluation of Vision-and-Language Navigation Instructions,2021-01-26,arxiv-search,seeded from targeted arXiv search for instruction-evaluation work,evaluation-paper,trusted
Language-guided Navigation via Cross-Modal Grounding and Alternate Adversarial Learning,2020-11-22,awesome-repo,seeded from awesome-vln representation-learning list and arXiv-first date verification,representation-paper,trusted
Diagnosing the Environment Bias in Vision-and-Language Navigation,2020-05-06,arxiv-search,seeded from targeted arXiv search for generalization and bias diagnosis work,analysis-paper,trusted
Vision-Dialog Navigation by Exploring Cross-modal Memory,2020-03-15,awesome-repo,seeded from awesome-vln dialog section and arXiv-first date verification,dialog-paper,trusted
Multi-View Learning for Vision-and-Language Navigation,2020-03-02,arxiv-search,seeded from targeted arXiv search for multi-view VLN learning,representation-paper,trusted
Sub-Instruction Aware Vision-and-Language Navigation,2020-04-06,arxiv-search,seeded from targeted arXiv search for fine-grained instruction supervision,instruction-granularity-paper,trusted
Multimodal Text Style Transfer for Outdoor Vision-and-Language Navigation,2020-07-01,awesome-repo,seeded from awesome-vln data-centric list and arXiv-first date verification,urban-language-paper,trusted
Vision-Language Navigation with Self-Supervised Auxiliary Reasoning Tasks,2019-11-18,awesome-repo,seeded from awesome-vln auxiliary-tasks list and arXiv-first date verification,auxiliary-task-paper,trusted
"Perceive, transform, and act: Multi-modal attention networks for vision-and-language navigation",2019-11-27,awesome-repo,seeded from awesome-vln representation-learning list and arXiv-first date verification,representation-paper,trusted
Talk2Nav: Long-Range Vision-and-Language Navigation with Dual Attention and Spatial Memory,2019-10-04,awesome-repo,seeded from awesome-vln datasets section and arXiv-first date verification,urban-navigation-paper,trusted
Transferable Representation Learning in Vision-and-Language Navigation,2019-08-09,awesome-repo,seeded from awesome-vln representation-learning list and arXiv-first date verification,representation-paper,trusted
Stay on the Path: Instruction Fidelity in Vision-and-Language Navigation,2019-05-29,awesome-repo,seeded from awesome-vln datasets and evaluation sections and arXiv-first date verification,evaluation-paper,trusted
Multi-modal Discriminative Model for Vision-and-Language Navigation,2019-05-31,awesome-repo,seeded from awesome-vln representation-learning list and arXiv-first date verification,representation-paper,trusted
Embodied Multimodal Multitask Learning,2019-02-04,arxiv-search,seeded from targeted arXiv search for multitask embodied navigation work,multitask-paper,trusted secondary
From language to goals: Inverse reinforcement learning for vision-based instruction following,2019-02-20,awesome-repo,seeded from awesome-vln reinforcement-learning list and arXiv-first date verification,reinforcement-learning-paper,trusted
Touchdown: Natural Language Navigation and Spatial Reasoning in Visual Street Environments,2018-11-29,awesome-repo,seeded from awesome-vln datasets and evaluation sections and arXiv-first date verification,urban-benchmark-paper,trusted
Reinforced Cross-Modal Matching and Self-Supervised Imitation Learning for Vision-Language Navigation,2018-11-25,awesome-repo,seeded from awesome-vln reinforcement-learning list and arXiv-first date verification,reinforcement-learning-paper,trusted
Look Before You Leap: Bridging Model-Free and Model-Based Reinforcement Learning for Planned-Ahead Vision-and-Language Navigation,2018-03-21,awesome-repo,seeded from awesome-vln reinforcement-learning list and arXiv-first date verification,reinforcement-learning-paper,trusted
NDH-Full: Learning and Evaluating Navigational Agents on Full-Length Dialogue,2021-11-01,awesome-repo,seeded from awesome-vln dialog section; month-level ACL publication date used temporarily because no arXiv preprint has been confirmed,dialog-benchmark-paper,trusted secondary; temporary non-arXiv date
A Framework for Learning to Request Rich and Contextually Useful Information from Humans,2021-10-14,arxiv-search,seeded from targeted arXiv search for asking-for-help embodied navigation work,asking-for-help-paper,trusted secondary
Look Wide and Interpret Twice: Improving Performance on Interactive Instruction-following Tasks,2021-06-01,arxiv-search,seeded from targeted arXiv search for interactive instruction-following work,interactive-instruction-paper,trusted secondary
A Benchmark for Interpreting Grounded Instructions for Everyday Tasks,2019-12-03,awesome-repo,seeded from awesome-vln benchmarks section and arXiv-first date verification,benchmark-paper,trusted secondary
"Help, Anna! Visual Navigation with Natural Multimodal Assistance via Retrospective Curiosity-Encouraging Imitation Learning",2019-09-04,awesome-repo,seeded from awesome-vln guidance section and arXiv-first date verification,asking-for-help-paper,trusted
RUN through the Streets: A New Dataset and Baseline Models for Realistic Urban Navigation,2019-09-19,arxiv-search,seeded from targeted arXiv search for urban and outdoor VLN resources,urban-benchmark-paper,trusted secondary
Learning to Map Natural Language Instructions to Physical Quadcopter Control using Simulated Flight,2019-10-21,arxiv-search,seeded from targeted arXiv search for aerial instruction-following navigation,aerial-instruction-paper,trusted secondary
Habitat-Matterport 3D Dataset (HM3D): 1000 Large-scale 3D Environments for Embodied AI,2021-09-16,awesome-repo,seeded from awesome-vln benchmark section and arXiv-first date verification,platform-dataset-paper,trusted secondary
Scenario Oriented Object Navigation with Graph-based Exploration,2021-03-31,awesome-repo,seeded from awesome-vln benchmark section and arXiv-first date verification,object-navigation-paper,trusted secondary
Habitat: A Platform for Embodied AI Research,2019-04-16,arxiv-search,seeded from targeted arXiv search for embodied AI platform papers repeatedly cited around VLN benchmarking,platform-paper,trusted secondary
Embodied Question Answering,2017-11-30,awesome-repo,seeded from awesome-vln benchmark section and arXiv-first date verification,embodied-qa-paper,trusted secondary
Building Generalizable Agents with a Realistic and Rich 3D Environment,2018-02-27,awesome-repo,seeded from awesome-vln benchmark section and OpenReview-first date verification,platform-paper,trusted secondary; temporary non-arXiv/OpenReview date
ReTouchdown: Adding Touchdown to StreetLearn as a Shareable Resource for Language Grounding Tasks in Street View,2020-01-10,awesome-repo,seeded from awesome-vln benchmarks section and arXiv-first date verification,urban-benchmark-paper,trusted secondary
Executing Instructions in Situated Collaborative Interactions,2019-10-08,awesome-repo,seeded from awesome-vln guidance section and arXiv-first date verification,collaborative-instruction-paper,trusted secondary
Shifting the Baseline: Single Modality Performance on Visual Navigation & QA,2018-11-01,awesome-repo,seeded from awesome-vln semantic-understanding section and arXiv-first date verification,analysis-paper,trusted secondary
Vision-Language Navigation for Aerial Robots: Towards the Era of Large Language Models,2026-04-09,arxiv-search,seeded from targeted arXiv search for aerial VLN surveys,survey,trusted secondary
"Aerial Vision-Language Navigation with a Unified Framework for Spatial, Temporal and Embodied Reasoning",2025-12-09,arxiv-search,seeded from targeted arXiv search for recent aerial VLN methods,aerial-vln-paper,trusted
OpenVLN: Open-world aerial Vision-Language Navigation,2025-11-09,arxiv-search,seeded from targeted arXiv search for open-world aerial VLN,aerial-vln-paper,trusted
Vision-and-Language Navigation with Analogical Textual Descriptions in LLMs,2025-09-29,arxiv-search,seeded from targeted arXiv search for recent LLM-based VLN methods,llm-era-paper,trusted
VLN-R1: Vision-Language Navigation via Reinforcement Fine-Tuning,2025-06-20,arxiv-search,seeded from targeted arXiv search for reinforcement fine-tuning in VLN,llm-era-paper,trusted
VL-Nav: Real-time Vision-Language Navigation with Spatial Reasoning,2025-02-02,arxiv-search,seeded from targeted arXiv search for real-time VLN systems,real-world-vln-paper,trusted secondary
Vision-and-Language Navigation Generative Pretrained Transformer,2024-05-27,arxiv-search,seeded from targeted arXiv search for generative-pretrained-transformer VLN methods,llm-era-paper,trusted
A Deployable Embodied Vision-Language Navigation System with Hierarchical Cognition and Context-Aware Exploration,2026-04-23,arxiv-search,seeded from systematic arXiv sweep for direct VLN titles,real-world-vln-paper,trusted
DeCoNav: Dialog enhanced Long-Horizon Collaborative Vision-Language Navigation,2026-04-14,arxiv-search,seeded from systematic arXiv sweep for direct VLN titles,dialog-paper,trusted
Stop Wandering: Efficient Vision-Language Navigation via Metacognitive Reasoning,2026-04-02,arxiv-search,seeded from systematic arXiv sweep for direct VLN titles,direct-vln-paper,trusted
Structured Observation Language for Efficient and Generalizable Vision-Language Navigation,2026-03-29,arxiv-search,seeded from systematic arXiv sweep for direct VLN titles,direct-vln-paper,trusted
DyGeoVLN: Infusing Dynamic Geometry Foundation Model into Vision-Language Navigation,2026-03-22,arxiv-search,seeded from systematic arXiv sweep for direct VLN titles,foundation-model-paper,trusted
Does Peer Observation Help? Vision-Sharing Collaboration for Vision-Language Navigation,2026-03-21,arxiv-search,seeded from systematic arXiv sweep for direct VLN titles,collaborative-vln-paper,trusted
Trajectory-Diversity-Driven Robust Vision-and-Language Navigation,2026-03-16,arxiv-search,seeded from systematic arXiv sweep for direct VLN titles,direct-vln-paper,trusted
