No.,title,first_submission_date,venue,source_tag,entry_type,trust_note
172,RUN through the Streets: A New Dataset and Baseline Models for Realistic Urban Navigation,2019-09-19,EMNLP 2019,arxiv-search,urban-benchmark-paper,trusted secondary
173,Robust Navigation with Language Pretraining and Stochastic Sampling,2019-09-05,EMNLP 2019,survey-citation,core-paper,trusted
174,"Help, Anna! Visual Navigation with Natural Multimodal Assistance via Retrospective Curiosity-Encouraging Imitation Learning",2019-09-04,EMNLP 2019,awesome-repo,asking-for-help-paper,trusted
175,Transferable Representation Learning in Vision-and-Language Navigation,2019-08-09,ICCV 2019,awesome-repo,representation-paper,trusted
176,General Evaluation for Instruction Conditioned Navigation using Dynamic Time Warping,2019-07-11,arXiv 2019,awesome-repo,evaluation-paper,trusted
177,Vision-and-Dialog Navigation,2019-07-10,CoRL 2019,survey-citation,core-paper,trusted
178,Embodied Vision-and-Language Navigation with Dynamic Convolutional Filters,2019-07-05,BMVC 2019,awesome-repo,representation-paper,trusted
179,Chasing Ghosts: Instruction Following as Bayesian State Tracking,2019-07-03,NeurIPS 2019,awesome-repo,graph-state-paper,trusted
180,Are You Looking? Grounding to Multiple Modalities in Vision-and-Language Navigation,2019-06-02,ACL 2019,survey-citation,analysis-paper,trusted
181,Multi-modal Discriminative Model for Vision-and-Language Navigation,2019-05-31,SpLU&RoboNLP Workshop 2019,awesome-repo,representation-paper,trusted
182,Stay on the Path: Instruction Fidelity in Vision-and-Language Navigation,2019-05-29,ACL 2019,awesome-repo,evaluation-paper,trusted
183,REVERIE: Remote Embodied Visual Referring Expression in Real Indoor Environments,2019-04-23,arXiv preprint,survey-citation,core-paper,trusted
184,Learning to Navigate Unseen Environments: Back Translation with Environmental Dropout,2019-04-08,NAACL 2019,survey-citation,core-paper,trusted
185,Tactical Rewind: Self-Correction via Backtracking in Vision-and-Language Navigation,2019-03-06,CVPR 2019,survey-citation,core-paper,trusted
186,The Streetlearn Environment and Dataset,2019-03-04,arXiv 2019,awesome-repo,dataset-paper,trusted secondary
187,Learning To Follow Directions in Street View,2019-03-01,arXiv 2019,awesome-repo,urban-navigation-paper,trusted secondary
188,From language to goals: Inverse reinforcement learning for vision-based instruction following,2019-02-20,arXiv 2019,awesome-repo,reinforcement-learning-paper,trusted
189,Self-Monitoring Navigation Agent via Auxiliary Progress Estimation,2019-01-10,ICLR 2019,survey-citation,core-paper,trusted
190,Vision-based Navigation with Language-based Assistance via Imitation Learning with Indirect Intervention,2018-12-10,CVPR 2019,awesome-repo,guidance-paper,trusted
191,Touchdown: Natural Language Navigation and Spatial Reasoning in Visual Street Environments,2018-11-29,CVPR 2019,awesome-repo,urban-benchmark-paper,trusted
192,Reinforced Cross-Modal Matching and Self-Supervised Imitation Learning for Vision-Language Navigation,2018-11-25,CVPR 2019,awesome-repo,reinforcement-learning-paper,trusted
193,Shifting the Baseline: Single Modality Performance on Visual Navigation & QA,2018-11-01,NAACL 2019,awesome-repo,analysis-paper,trusted secondary
194,Mapping Instructions to Actions in 3D Environments with Visual Goal Prediction,2018-09-04,EMNLP 2018,awesome-repo,dataset-task-paper,trusted
195,On Evaluation of Embodied Navigation Agents,2018-07-18,arXiv 2018,awesome-repo,evaluation-paper,trusted
196,Navigating New York City through Grounded Dialogue,2018-07-09,arXiv 2018,awesome-repo,dialog-navigation-paper,trusted secondary
197,Speaker-Follower Models for Vision-and-Language Navigation,2018-06-07,NeurIPS 2018,survey-citation,core-paper,trusted
198,Following High-level Navigation Instructions on a Simulated Quadcopter with Imitation Learning,2018-05-31,RSS 2018,awesome-repo,aerial-precursor-paper,trusted
199,Look Before You Leap: Bridging Model-Free and Model-Based Reinforcement Learning for Planned-Ahead Vision-and-Language Navigation,2018-03-21,ECCV 2018,awesome-repo,reinforcement-learning-paper,trusted
200,Vision-and-Language Navigation: Interpreting visually-grounded navigation instructions in real environments,2017-11-20,CVPR 2018,survey-citation,core-paper,trusted
